{
  "id": "example-note-001",
  "kind": "thought",
  "title": "Scaffold validation smoke",
  "body_markdown": "This file exists to exercise JSON Schema validation in Phase 1 smoke tests.",
  "created_at": "2026-04-17T12:00:00Z",
  "tags": ["scaffold", "smoke"],
  "links": ["docs/implementation-log.md"]
}
